<?xml version="1.0" encoding="UTF-8" standalone="yes"?>
<CoverLetter xmlns="http://localhost:8080/CoverLetter" xmlns:xsi="http://www.w3.org/2001/XMLSchema-instance" paperId="1" paperTitle="Title" manuscriptTitle="Naslov poruke" xsi:schemaLocation="C:\Users\Damir\Desktop\xml_naucniradovi\xml\target\classes\data\schemas\CoverLetter.xsd">
    <AuthorData authorsPhone="0000000" authorsAddress="Adresa">
        <authorsName>Ime Prvog</authorsName>
        <authorsEmail>Email@prvog.com</authorsEmail>
    </AuthorData>
    <AuthorData authorsPhone="0000000">
        <authorsName>Ime Drugog</authorsName>
        <authorsEmail>Email@drugog.com</authorsEmail>
    </AuthorData>
    <Content>Some content of Cover letter by me</Content>
</CoverLetter>
